{
  "schema_version": "dataset-manifest.v1",
  "dataset_id": "commander-completion-v1-fixture",
  "created_at": "2026-08-10T18:00:00Z",
  "builder_version": "dataset-builder-v1",
  "code_commit": "abcdef1234567890",
  "ruleset_versions": [
    "commander-2026-02-09"
  ],
  "card_snapshot_ids": [
    "cards-2026-08-10"
  ],
  "source_snapshots": [
    "fixture-2026-08-10"
  ],
  "filters": {
    "legal_only": true
  },
  "split_policy": {
    "strategy": "temporal_grouped"
  },
  "tables": [
    {
      "name": "completion_examples",
      "path": "test/examples.parquet",
      "sha256": "1111111111111111111111111111111111111111111111111111111111111111",
      "rows": 10
    }
  ],
  "counts": {
    "train": 6,
    "validation": 2,
    "test": 2
  },
  "quality_report": "reports/quality.json",
  "leakage_report": "reports/leakage.json",
  "redistribution_status": "redistributable",
  "sha256": "2222222222222222222222222222222222222222222222222222222222222222"
}
